{"data":{"readiness":{"complete":true,"pending":[],"release":"complete"},"recording":{"analysis":{"status":"completed","topics":[{"importance":0.93,"keywords":["contract","webhook","idempotency"],"spans":[{"tEndMs":100000,"tStartMs":70000}]}]},"artifacts":[{"bytes":1048576,"delivery":"uploaded","mimeType":"video/webm","type":"tab-recording","viewUrl":"https://drive.google.com/file/d/contract-fixture-v1/view"}],"durationMs":2700000,"endedAt":"2026-10-07T12:00:00.000Z","id":"recording_contract_fixture_v1","notations":[{"tEndMs":91000,"text":"Review retry and idempotency semantics.","tStartMs":75000}],"note":"Confirm the CRM receiver contract before rollout.","source":{"kind":"meeting","meetingId":"abc-defg-hij","meetingUrl":"https://meet.google.com/abc-defg-hij","provider":"google-meet"},"startedAt":"2026-10-07T11:15:00.000Z","title":"CRM contract review","transcript":{"segments":[{"speaker":"Speaker 1","tEndMs":4500,"text":"The receiver verifies the exact signed payload bytes.","tStartMs":0}],"source":"meet-captions"}},"revision":1},"datacontenttype":"application/json","id":"event_contract_ready_v1","source":"urn:meeting-recorder:destination:producer_contract_fixture_v1","specversion":"1.0","subject":"recording/recording_contract_fixture_v1","time":"2026-10-07T12:01:00.000Z","type":"io.github.kstroevsky.meeting-recorder.recording.ready.v1"}